{
  "schema_version": "1.0.0",
  "protocol_version": "1.0.0",
  "knowledge_version": "none",
  "task_id": "SYN-TASK-1",
  "race_id": "20000101-01-01",
  "baseline_prediction_id": "SYN-PRED-WAIT",
  "baseline_sha256": "1306ed0fafdb071f1674c37daa7ec2c2586954e5da3232e7672c6617816d8d70",
  "evidence_id": "SYN-EV-2",
  "locked_at": "2000-01-01T14:40:00+09:00",
  "synthetic": true,
  "decision_id": "SYN-DEC-SKIP",
  "final": "SKIP",
  "changes": [],
  "skip_analysis": {
    "reason": "SYNTHETIC: exhibition contradicts baseline and no edge remains",
    "evidence_ids": [
      "e1",
      "e3",
      "ei1"
    ]
  }
}
